{
  "$schema": "./modification.schema.json",
  "id": "MOD-0001",
  "classification": "product-specific",
  "status": "active",
  "paths": ["apps/server/src/storage"],
  "owner": "product-maintainer@example.com",
  "reason": "Documented buyer-specific storage provider behaviour.",
  "evidence": { "tests": ["pnpm test:template"] },
  "impact": { "security": "medium", "data": "low", "compatibility": "low" }
}
